{
  "mapping_version": "candidate-crosswalk-v0.1",
  "record_schema_profile": "candidate-record-v0.1",
  "research_snapshot": "2026-09-18",
  "description": "Machine-readable candidate field/concept crosswalks. These mappings are non-normative and do not claim standards conformance, certification, or authenticated identity unless separately evidenced.",
  "profiles": [
    {
      "profile_id": "opentelemetry-genai",
      "source_name": "OpenTelemetry OTLP + GenAI semantic conventions",
      "source_version": "GenAI reviewed commit 547934afa90a34298441caf80c43b27255c3a292 (2026-10-20); OTLP references retained",
      "status": "implemented_adapter",
      "adapter_path": "adapters/otel_genai.py",
      "reference_uris": [
        "https://opentelemetry.io/docs/specs/otlp/",
        "https://github.com/open-telemetry/semantic-conventions-genai/blob/547934afa90a34298441caf80c43b27255c3a292/docs/gen-ai/gen-ai-agent-spans.md",
        "https://github.com/open-telemetry/semantic-conventions-genai/blob/547934afa90a34298441caf80c43b27255c3a292/docs/gen-ai/gen-ai-spans.md"
      ],
      "notes": "Telemetry is observed execution evidence. Authorization, materiality, and principal identity remain separate evidence.",
      "mappings": [
        {
          "mapping_id": "otel.trace-id",
          "source_expression": "OTLP span.traceId",
          "decision": "map",
          "evidence_class": "correlation",
          "target_path": "trace_id",
          "transform": "Validate 32 hexadecimal characters, reject all-zero value, normalize lowercase.",
          "notes": "One logical GenAI trace is adapted per candidate record."
        },
        {
          "mapping_id": "otel.span-id",
          "source_expression": "OTLP span.spanId",
          "decision": "map",
          "evidence_class": "correlation",
          "target_path": "events[].event_id",
          "transform": "Validate 16 hexadecimal characters, reject all-zero value, normalize lowercase, prefix with 'otel-span:'.",
          "notes": "Provides stable event identity within the adapted trace."
        },
        {
          "mapping_id": "otel.start-time",
          "source_expression": "OTLP span.startTimeUnixNano",
          "decision": "map",
          "evidence_class": "observed_execution",
          "target_path": "events[].occurred_at",
          "transform": "Convert Unix nanoseconds to RFC 3339 UTC while preserving significant nanosecond digits.",
          "notes": "This preserves source timestamp precision but does not prove source clock accuracy."
        },
        {
          "mapping_id": "otel.agent-id",
          "source_expression": "gen_ai.agent.id",
          "decision": "map",
          "evidence_class": "descriptive_identity",
          "target_path": "system.agent_id",
          "transform": "Require one unambiguous value across the adapted trace unless explicitly overridden by sidecar context.",
          "notes": "OpenTelemetry describes the instrumented agent identity; deployments still need separate authentication/trust policy for security identity."
        },
        {
          "mapping_id": "otel.agent-version",
          "source_expression": "gen_ai.agent.version or resource service.version",
          "decision": "map",
          "evidence_class": "descriptive_identity",
          "target_path": "system.version",
          "transform": "Use gen_ai.agent.version when uniquely available; otherwise allow service.version or explicit sidecar override.",
          "notes": "Version metadata is descriptive evidence."
        },
        {
          "mapping_id": "otel.provider",
          "source_expression": "gen_ai.provider.name",
          "decision": "map",
          "evidence_class": "provenance",
          "target_path": "system.provider",
          "notes": "Provider semantic-convention value is preserved when present and unambiguous."
        },
        {
          "mapping_id": "otel.model",
          "source_expression": "gen_ai.request.model",
          "decision": "map",
          "evidence_class": "provenance",
          "target_path": "system.model",
          "notes": "Request model metadata is preserved when present and unambiguous."
        },
        {
          "mapping_id": "otel.operation",
          "source_expression": "gen_ai.operation.name plus gen_ai.tool.name for execute_tool",
          "decision": "map",
          "evidence_class": "observed_execution",
          "target_path": "events[].operation",
          "transform": "For execute_tool spans use gen_ai.tool.name; otherwise preserve gen_ai.operation.name.",
          "notes": "This yields an operation value that can be compared with delegated authority scope."
        },
        {
          "mapping_id": "otel.status",
          "source_expression": "OTLP span status, endTimeUnixNano, and error.type",
          "decision": "map",
          "evidence_class": "observed_execution",
          "target_path": "events[].status",
          "transform": "Error -> failed; missing end time -> pending; otherwise completed, unless stronger sidecar evidence supplies an override.",
          "notes": "Execution status is not authorization status."
        },
        {
          "mapping_id": "otel.data-source",
          "source_expression": "gen_ai.data_source.id",
          "decision": "map",
          "evidence_class": "source_evidence",
          "target_path": "sources[].source_id",
          "notes": "Materiality and source role are supplied separately; presence in telemetry does not make a source material."
        },
        {
          "mapping_id": "otel.tool-arguments",
          "source_expression": "gen_ai.tool.call.arguments",
          "decision": "exclude",
          "evidence_class": "sensitive_content",
          "notes": "Tool arguments may contain sensitive content and are intentionally not copied into the canonical record."
        },
        {
          "mapping_id": "otel.tool-result",
          "source_expression": "gen_ai.tool.call.result",
          "decision": "exclude",
          "evidence_class": "sensitive_content",
          "notes": "Tool results may contain sensitive content and are intentionally not copied into the canonical record."
        }
      ]
    },
    {
      "profile_id": "mcp-2026-07-28",
      "source_name": "Model Context Protocol",
      "source_version": "2026-07-28",
      "status": "implemented_adapter",
      "adapter_path": "adapters/mcp_2026.py",
      "reference_uris": [
        "https://github.com/modelcontextprotocol/modelcontextprotocol/blob/main/docs/specification/2026-07-28/basic/index.mdx",
        "https://blog.modelcontextprotocol.io/posts/2026-07-28/"
      ],
      "notes": "MCP protocol metadata is observed/descriptive evidence. Authenticated identity and authorization come from a separate control-plane sidecar in the current adapter.",
      "mappings": [
        {
          "mapping_id": "mcp.request-id",
          "source_expression": "JSON-RPC request id for tools/call",
          "decision": "map",
          "evidence_class": "correlation",
          "target_path": "events[].event_id",
          "transform": "Prefix with 'mcp-request:'.",
          "notes": "The adapter also requires the response id to match."
        },
        {
          "mapping_id": "mcp.tool-name",
          "source_expression": "tools/call params.name",
          "decision": "map",
          "evidence_class": "observed_execution",
          "target_path": "events[].operation",
          "notes": "Mcp-Name is checked against params.name when the routing header is present."
        },
        {
          "mapping_id": "mcp.observed-time",
          "source_expression": "capture request_observed_at",
          "decision": "map",
          "evidence_class": "observed_execution",
          "target_path": "events[].occurred_at",
          "notes": "This timestamp belongs to the capture substrate, not to the MCP wire schema itself."
        },
        {
          "mapping_id": "mcp.response-status",
          "source_expression": "JSON-RPC error or tools/call result state",
          "decision": "map",
          "evidence_class": "observed_execution",
          "target_path": "events[].status",
          "transform": "JSON-RPC error or isError -> failed; input_required -> pending; otherwise completed, unless stronger sidecar evidence overrides.",
          "notes": "Successful protocol execution is not proof of authorization."
        },
        {
          "mapping_id": "mcp.client-info",
          "source_expression": "_meta['io.modelcontextprotocol/clientInfo']",
          "decision": "exclude",
          "evidence_class": "descriptive_identity",
          "notes": "The MCP specification describes clientInfo as self-reported and not verified by the protocol; it is not used as authenticated system/delegate identity."
        },
        {
          "mapping_id": "mcp.server-info",
          "source_expression": "result._meta['io.modelcontextprotocol/serverInfo']",
          "decision": "exclude",
          "evidence_class": "descriptive_identity",
          "notes": "Self-reported server implementation metadata is not used as authenticated identity or authorization evidence."
        },
        {
          "mapping_id": "mcp.authenticated-agent",
          "source_expression": "external authenticated control-plane identity",
          "decision": "support",
          "evidence_class": "authenticated_identity",
          "target_path": "system.agent_id",
          "notes": "Current adapter sidecar supplies the authenticated agent identity because MCP clientInfo is not security identity."
        },
        {
          "mapping_id": "mcp.delegated-scope",
          "source_expression": "external authorization/control-plane evidence",
          "decision": "support",
          "evidence_class": "authorization",
          "target_path": "authority.scope",